{
  "schemaVersion": "asi.agent-os.github-protection-desired.v1",
  "repository": "ASI-integration/asi-landing",
  "mainProtection": {
    "branch": "main",
    "requirePullRequest": true,
    "requiredApprovingReviewCount": 0,
    "dismissStaleReviews": true,
    "requireCodeOwnerReviews": false,
    "requiredStatusChecks": ["validate"],
    "blockDirectPush": true,
    "allowForcePushes": false,
    "allowDeletions": false,
    "includeAdministrators": true
  },
  "environments": [
    {
      "name": "staging",
      "requiredReviewers": ["ASI-integration"],
      "deploymentBranches": ["main"],
      "canAdminsBypass": false,
      "preventSelfReview": false
    },
    {
      "name": "production",
      "requiredReviewers": ["ASI-integration"],
      "deploymentBranches": ["main"],
      "canAdminsBypass": false,
      "preventSelfReview": false
    },
    {
      "name": "production-migration-approval",
      "requiredReviewers": ["ASI-integration"],
      "deploymentBranches": ["main"],
      "canAdminsBypass": false,
      "preventSelfReview": false
    }
  ],
  "ownerActionsRequired": [
    "Enable enforced main branch protection with PR + required check validate (human-review count is 0 by deliberate solo-owner policy; see docs/agent-os/GITHUB_PROTECTION.md)",
    "Add required reviewers and main-only deployment policy on staging; disable admin bypass",
    "Confirm production and production-migration-approval keep required reviewers + main-only policy with admin bypass disabled",
    "Verify with a docs-only test PR and a staging environment wait-for-review dispatch (no mutation)"
  ],
  "closure": {
    "ao001": "open",
    "ao002": "open",
    "requiresLiveVerification": true
  }
}
